Text_Chunks,Translation_to_SPA
"Hi everybody, it’s your old pal Sarah. I was in the past few months has been a lot of press, a lot of gowns, a lot of things. And I was in a gown. So ridiculous. And I had to wear Spanx under it, not for shapewear reasons. Not that there’s anything wrong with that. But I had to because of thyroid because it was a tight dress. And when I can’t wear a tight, you know, skirt without like, shorts or something because I get thigh rub and it’s real. It like burns like fire. So I was wearing these Spanx, and then they to pee. There’s a slit in the Spanx that up through a hole, right. And I just thought it would be interesting to mention, because when you’re doing it, so I’m like basically holding a gown in my arms. And now kind of have to move it to one arm, like hold everything. And then open up this p whole envelope thing at my crotch. And then I have to have a conversation with myself. Because it feels like you’re peeing with pants on. And your body’s like, no. And I’m like, no trust me. And my body’s like, no there’s pants on. And I go, no, just relax trust me, there’s an opening. And I have to relax and I have to coax my urine out. That’s a lot going on.","Hola a todos, soy tu vieja amiga Sarah. Estuve en los últimos meses ha habido mucha prensa, muchos vestidos, muchas cosas. Y yo estaba en bata. Tan ridiculo. Y tuve que usar Spanx debajo, no por motivos de faja. No es que haya nada malo en eso. Pero tuve que hacerlo por culpa de la tiroides porque era un vestido ajustado. Y cuando no puedo usar una falda ajustada, ya sabes, sin pantalones cortos o algo así, porque me frotan los muslos y es real. Parece que arde como el fuego. Así que llevaba estos Spanx y luego los usaba para orinar. Hay una hendidura en el Spanx que pasa por un agujero, cierto. Y pensé que sería interesante mencionarlo, porque cuando lo haces, básicamente estoy sosteniendo un vestido en mis brazos. Y ahora tengo que moverlo a un brazo, como si sostuviera todo. Y luego abre todo este sobre en mi entrepierna. Y luego tengo que tener una conversación conmigo mismo. Porque se siente como si estuvieras orinando con los pantalones puestos. Y tu cuerpo dice, no. Y yo digo, no confíes en mí. Y mi cuerpo dice, no, hay pantalones puestos. Y yo digo, no, simplemente relájate, confía en mí, hay una oportunidad. Y tengo que relajarme y tengo que sacar mi orina. Están sucediendo muchas cosas."
I have a question. ask you about that.,Tengo una pregunta. preguntarte sobre eso.
"Okay, go on.","Está bien, continúa."
"When you because I’ve never been able to do that. Like, I feel like it still gets everywhere. Like, did you have a clean pee?",Cuando tú porque nunca he podido hacer eso. Siento que todavía llega a todas partes. ¿Tuviste una orina limpia?
"Shockingly, I did because usually my pee comes from I don’t know exactly where but I know at least three to four different places.","Sorprendentemente, lo hice porque normalmente mi orina proviene de no sé exactamente de dónde, pero conozco al menos de tres a cuatro lugares diferentes."
Because my fear with that is like up and then like you’re just sitting with a wet crotch the rest of the night.,Porque mi miedo con eso es como levantarme y luego estar sentado con la entrepierna mojada el resto de la noche.
"Yeah, like sometimes I pee one solid stream. And sometimes it’s like, sprinklers. It’s literally like, am I watering grass in a nearby area? Totally like, yeah. I mean, does that mean there’s because usually if you turn on your faucet and it goes different places, there’s like a clog somewhere that’s like pushing it. So is there a clog in my urethra?","Sí, a veces orino un chorro continuo. Y a veces es como aspersores. Es literalmente como, ¿estoy regando el césped de un área cercana? Totalmente parecido, sí. Quiero decir, ¿eso significa que hay porque generalmente si abres el grifo y va a diferentes lugares, hay como una obstrucción en alguna parte que es como empujarlo? Entonces, ¿hay una obstrucción en mi uretra?"
"Well, I’m sure this is a clinical reason, but it’s probably because your labia is like stuck together and it’s just bouncing.","Bueno, estoy seguro de que esto es una razón clínica, pero probablemente se deba a que tus labios vaginales están pegados y simplemente rebotan."
"Oh my god, wait. So if I pull open, my vulva, my labia majora, open that’s the sound it makes. It should be a single stream. But uh, you know if you’re I know what you mean when your lips are kind of sealed from like this. Like the I can picture like pee coming in almost like going straight to the back before like opening up. She’s dying. We have fun here at the Sarah Silverman podcast.","Dios mío, espera. Entonces, si abro, mi vulva, mis labios mayores, abro, ese es el sonido que hace. Debería ser una sola corriente. Pero, sabes, si lo eres, sé a qué te refieres cuando tus labios están sellados de esta manera. Puedo imaginarme como si la orina entrara casi como si fuera directamente hacia atrás antes de abrirse. Ella se está muriendo. Nos divertimos aquí en el podcast de Sarah Silverman."
The moral is it’s so much easier to pee when you’re a man it is period.,La moraleja es que es mucho más fácil orinar cuando eres hombre y punto.
"And you know, I remember years ago, I bought something online that was that you could stand up and pee for women. It was like, like a cup that you put over your vulva and then it comes out like basically like a makeshift penis. And you can stand in pee, and I used it, I remember I was at Jessica’s friend’s house. We were watching the oddly like the man show, season something Premiere or whatever. I don’t know why I remember that. And I go, oh, I’m gonna use my standing pee thing. And I used it, and it worked. But it made me feel so weird. Like I was just by myself, you know, maybe just gotta look to little.","Y sabes, recuerdo que hace años compré algo en línea que permitía a las mujeres ponerse de pie y orinar. Era como una copa que te pones sobre la vulva y luego sale básicamente como un pene improvisado. Y puedes pararte para orinar, y lo usé, recuerdo que estaba en la casa de una amiga de Jessica. Estábamos viendo el programa extraño como el hombre, la temporada, el estreno o lo que sea. No sé por qué recuerdo eso. Y digo, oh, voy a usar mi cosa de orinar de pie. Y lo usé y funcionó. Pero me hizo sentir muy raro. Como si estuviera solo, ya sabes, tal vez solo tenga que mirar un poco."
Is it like a funnel?,¿Es como un embudo?
"It’s like a funnel basically, it’s a funnel. And you’d think oh, great. Gonna have it in cars gonna have it. I’m gonna have it for you know, whatever, it’s like if you go to a concert if you go to, because guys don’t realize like when you have to sit, and you’re like, it’s fun to go to a dingy dive bar until you’re a woman and you have to pee. It’s like a whole process.","Básicamente es como un embudo, es un embudo. Y pensarías oh, genial. Lo tendremos en los coches. Lo tendremos. Lo tendré para que ya sabes, lo que sea, es como si fueras a un concierto si vas, porque los chicos no se dan cuenta cuando tienes que sentarte, y piensas, es divertido ir a un bar sucio hasta que eres mujer y tienes que orinar. Es como todo un proceso."
I’m a two seat cover kind of girl over here.,Soy una chica del tipo que cubre dos asientos por aquí.
"Needless to say, we I think even the audience knows this.",No hace falta decir que creo que incluso el público lo sabe.
"Which is why, Chicago O’Hare Airport is the best place so good to be.","Por eso, el Aeropuerto O’Hare de Chicago es el mejor lugar para estar."
"That’s the one where you press the button and it it’s a brand new like, covered in a bag.","En ese es en el que presionas el botón y es como nuevo, cubierto en una bolsa."
Yes.,Sí.
It’s why don’t they do that everywhere? Why is it every airport this way?,¿Por qué no hacen eso en todas partes? ¿Por qué todos los aeropuertos son así?
But then I also know they say like seat seats are like the cleanest?,Pero también sé que dicen que los asientos son los más limpios.
"Yes, the seats I sit down like I just sat down on the seat here, it’s immaculate.","Sí, los asientos en los que me siento como si me acabara de sentar aquí, están impecables."
"Yeah, that’s not ever gonna be me.","Sí, ese nunca seré yo."
"Yeah, I know. But like tushy cheeks aren’t dirty.",Si lo se. Pero como si las mejillas con tus traseros no estuvieran sucias.
"I know, but that’s that’s yours. I mean, we could probably make an argument that tushy cheeks are incredibly dirty, depending on how well someone’s wiping.","Lo sé, pero eso es tuyo. Quiero decir, probablemente podríamos argumentar que las mejillas con traseros están increíblemente sucias, dependiendo de qué tan bien se limpie alguien."
"Oh, god, yeah, if you shit it on your ass cheeks, your there’s you’ve got more problems. I’m guessing, there’s no way your only problem in life is you smear shit on your ass cheeks when you wipe God. Anyway, let’s take some calls.","Oh, Dios, sí, si te lo cagas en las nalgas, tendrás más problemas. Supongo que no hay forma de que tu único problema en la vida sea que te untes mierda en las nalgas cuando limpias a Dios. De todos modos, atendamos algunas llamadas."
"Hi, Sarah, this is Kelly and I was hoping to ask you your opinion on long term goals. I am a small business owner, 44 years old. And I wanted to know how you approach long term goals. Because to me, they’re kind of moot because we’re not in control of everything so I look to the future. I know, like by 64, I would want to sell my business or retire. It’s like 20 years. But then I think about like all the stuff that can happen and 20 years, especially with how unstable everything is right now. So I struggle with developing those long term goals. And then I even struggle with the short term goals to get me to that long term goal, if that makes any sense. Yeah, I just wanted to get your opinion on that. And see how you as a business owner and media personality and fantastic person all around if you have any advice for that, because you have great advice, and thank you so much for all your wonderful entertaining, comedy and advice. It is something that I look forward to every Thursday morning when I’m walking my dog, Biscuit. So thanks so much, and hope to hear from you soon.","Hola, Sarah, soy Kelly y esperaba pedirte tu opinión sobre los objetivos a largo plazo. Soy propietario de una pequeña empresa, tengo 44 años. Y quería saber cómo abordas los objetivos a largo plazo. Porque para mí son un poco discutibles porque no tenemos el control de todo, así que miro hacia el futuro. Sé que, cuando tenga 64 años, me gustaría vender mi negocio o jubilarme. Son como 20 años. Pero luego pienso en todas las cosas que pueden pasar en 20 años, especialmente en lo inestable que es todo ahora. Por eso me cuesta desarrollar esos objetivos a largo plazo. Y luego incluso lucho con las metas a corto plazo para llegar a la meta a largo plazo, si eso tiene algún sentido. Sí, sólo quería saber tu opinión sobre eso. Y vea cómo usted, como propietario de un negocio, personalidad de los medios y persona fantástica, tiene algún consejo al respecto, porque tiene excelentes consejos y muchas gracias por todo su maravilloso entretenimiento, comedia y consejos. Es algo que espero con ansias todos los jueves por la mañana cuando salgo a pasear a mi perro, Biscuit. Muchas gracias y espero tener noticias tuyas pronto."
"Hi Biscuit, you gonna walk? You gonna walk? Hey, biscuit. I just want you to play that for Biscuit. I wouldn’t say I’m goalless. But I always struggle with this because they never think about like, I want to do this in the next five years or I want to […] but I mean, I think because I’ve really come to a place where I fully understand and accept that I’ve never been able to predict the future and will never be able to predict the future so that helps me with anxiety, you know, just not trying to predict the future not trying to worry, tell myself horror stories about how that’s going to unfold because we just never know, we’ve never been able to know, you’ve never been able to predict anything your life. And neither have I. But in terms of long term goals, I mean things that I’ve said to friends, you know, who asked, I would say, make a plan, like you have 20 more years of your business and then retire, you’re making a long term goal. And then you follow that plan, follow that plan until it no longer serves you if you know there’s gonna, it’s either going to, you’re going to see it through through fruition and everything will go as planned, and more likely other things will happen, life will happen that will take you in a different direction and you’ll make a new plan. You know, I mean, goals are great, but it’s of course the road getting to those goals, that is the stuff of life, you have to hopefully enjoy that stuff. You know, because the goal either comes or doesn’t, you know, but the road get going there should be your joy, you know, obviously, like, maybe your joy isn’t working at all, you know, is not having a job or not having a business but you need to, you know, also being responsible for your happiness includes, you know, taking care of yourself financially so obviously it’s a mix of all those things. But um, you know, you got a long term goal. You have a plan to get there and follow that plan unless and until it doesn’t serve you anymore and then you make a new one. I don’t know what else? What other advice I can give along that but it sounds like you’re you’re doing great. But you know, I mean, not fulfilling a goal isn’t necessarily failure and failure isn’t even necessarily bad. So control what you can control and be on the edge of your seat for the rest of it. Good luck, what else?","Hola Biscuit, ¿vas a caminar? ¿Vas a caminar? Oye, galleta. Sólo quiero que toques eso para Biscuit. No diría que no tengo goles. Pero siempre lucho con esto porque nunca piensan en: quiero hacer esto en los próximos cinco años o quiero […] pero quiero decir, creo que porque realmente he llegado a un lugar donde entiendo completamente y Aceptar que nunca he podido predecir el futuro y que nunca podré predecir el futuro, eso me ayuda con la ansiedad, ya sabes, simplemente no intentar predecir el futuro, no intentar preocuparme, contarme historias de terror sobre cómo es eso. se va a desarrollar porque simplemente nunca lo sabemos, nunca hemos podido saberlo, nunca has podido predecir nada en tu vida. Y yo tampoco. Pero en términos de objetivos a largo plazo, me refiero a cosas que les he dicho a amigos, ya sabes, que me pidieron, yo diría, hacer un plan, como si tuvieras 20 años más de tu negocio y luego jubilarte. , estás estableciendo un objetivo a largo plazo. Y luego sigues ese plan, sigues ese plan hasta que ya no te sirva, si sabes que lo hará, lo llevarás a cabo y todo saldrá según lo planeado, y lo más probable es que otras cosas sucedan. sucederá, sucederá una vida que te llevará en una dirección diferente y harás un nuevo plan. Ya sabes, quiero decir, las metas son geniales, pero, por supuesto, es el camino para alcanzar esas metas, esa es la esencia de la vida, con suerte hay que disfrutarlas. Ya sabes, porque la meta llega o no llega, ya sabes, pero el camino para llegar allí debería ser tu alegría, ya sabes, obviamente, tal vez tu alegría no esté funcionando en absoluto, ya sabes, es no tener un trabajo o no tener un negocio, pero lo necesitas, ya sabes, también ser responsable de tu felicidad incluye, ya sabes, cuidarte financieramente, así que obviamente es una combinación de todas esas cosas. Pero ya sabes, tienes un objetivo a largo plazo. Tienes un plan para llegar allí y seguir ese plan a menos y hasta que ya no te sirva y luego creas uno nuevo. ¿No sé qué más? ¿Qué otro consejo puedo darte? Parece que lo estás haciendo muy bien. Pero ya sabes, quiero decir, no cumplir una meta no es necesariamente un fracaso y el fracaso ni siquiera es necesariamente malo. Así que controla lo que puedas controlar y mantente al borde de tu asiento durante el resto. Buena suerte, ¿qué más?"
"I Sarah, what would be your favorite deep cut of yours? Like someone a fan passes you on the street? And they say, oh my god, I loved you in what’s the thing someone could say they saw and loved you and or like heard you in or knew that you were involved with that would make you most jazzed about that fun interaction?","Yo, Sarah, ¿cuál sería tu corte profundo favorito? ¿Como si un fan se cruzara contigo en la calle? Y dicen, oh Dios mío, te amé en ¿qué es lo que alguien podría decir que te vio y amó o que te escuchó o supo que estabas involucrado en eso que te entusiasmaría más con esa interacción divertida?"
"Well, it’s, you know, again, I like that I do odd jobs, and it’s just funny. The way people know me like there are certain people that know me from Star Trek Voyager. And then there are people that only know me from Howard Stern. And then there are people that know me from like, Monk. And then there are people that are like, I was at Canter’s the other day, and the waitress goes, and I counters it’s like, I love counters all the waitresses are like, waitress all the servers sorry, are like 78 you know? But she goes, are you who you are? Are you who I think you are? And I go I maybe she goes, where are you the one from Marry Me? I was like, oh, yeah, I was in that movie. I guess I was like a friend and then movie. There are also people who know me, there are people just know me from stand up. So they just go oh, she’s really dirty, or she’s really blue. And then there’s people who know me, like I said from like, Monk, and they go, Oh, this is the one from Monk will go see her live and then they’re horrified. You know, there’s also people who who will reference. This is a deep cut is the way of the gun, which is a movie that I’m in just the first scene before the credits. And my character’s name, which I didn’t know until I saw it. And they it says just as raving bitch. But I get beat up by a lovely Ryan Philippi. And it’s a really dark, great movie. I think it’s Christopher McQuarrie, his first movie that he directed, but um, that was one of the three times I was punched in the face, because the other ones were more on purpose. But Ryan beats me up and we of course, you know, practice and we’re taught how to do it and everything. And I know, this sounds like a you know, I don’t mean to blame myself, but I think I’m I maybe I leaned in or something, whatever. But he fully connected, knocked to me off my feet. By the time I opened my eyes, I probably would have cried. But um, he was already crying. I think I’ve already told the story. So I was immediately like, it’s okay. He felt awful but it was cool. I had a huge like black and blue egg on my jaw. And that I believe that was the tape they used. And if not, they actually use the sound from it cracking my job because you can hear it. But that’s a good one. That’s a deep cut for sure.","Bueno, ya sabes, una vez más, me gusta hacer trabajos ocasionales y es simplemente divertido. La forma en que la gente me conoce es que hay ciertas personas que me conocen de Star Trek Voyager. Y luego hay gente que sólo me conoce de Howard Stern. Y luego hay gente que me conoce, como Monk. Y luego hay gente que dice, estuve en Canter's el otro día, y la camarera va, y yo contesto, me encantan los mostradores, todas las camareras son, camarera, todos los camareros lo siento, son como 78, ¿sabes? Pero ella dice, ¿eres tú quien eres? ¿Eres quien creo que eres? Y yo voy y tal vez ella vaya, ¿dónde estás tú, el de Marry Me? Pensé, oh, sí, estuve en esa película. Supongo que era como un amigo y luego una película. También hay gente que me conoce, hay gente que me conoce simplemente de pie. Entonces simplemente dicen: ""Está muy sucia o está muy azul"". Y luego hay gente que me conoce, como dije de Monk, y dicen: Oh, esta es la de Monk, irá a verla en vivo y luego se horrorizan. Ya sabes, también hay personas que harán referencia. Este es un corte profundo en The Way of the Gun, que es una película en la que estoy justo en la primera escena antes de los créditos. Y el nombre de mi personaje, que no supe hasta que lo vi. Y ellos dicen igual de perra delirante. Pero un encantador Ryan Philippi me golpea. Y es una gran película realmente oscura. Creo que es Christopher McQuarrie, la primera película que dirigió, pero um, esa fue una de las tres veces que me golpearon en la cara, porque las otras fueron más a propósito. Pero Ryan me golpea y, por supuesto, ya sabes, practicamos y nos enseñan cómo hacerlo y todo. Y lo sé, esto suena como, ya sabes, no quiero culparme a mí mismo, pero creo que tal vez me incliné o algo así, lo que sea. Pero él conectó completamente y me derribó. Cuando abrí los ojos, probablemente habría llorado. Pero bueno, ya estaba llorando. Creo que ya he contado la historia. Entonces pensé inmediatamente, está bien. Se sintió fatal pero fue genial. Tenía un enorme huevo negro y azul en la mandíbula. Y esa creo que esa fue la cinta que usaron. Y si no, en realidad usan el sonido que genera para romper mi trabajo porque puedes escucharlo. Pero esa es buena. Seguro que es un corte profundo."
"Hi, Sarah, my name is Emily. I nine years old. And I really want to be an actor. My mom doesn’t know if he wants me to do it. Because he said actor kids are spoiled brats. My question is, do you ever work with kids? And it’s my mom, right?","Hola Sara, mi nombre es Emily. Yo tengo nueve años. Y tengo muchas ganas de ser actor. Mi mamá no sabe si quiere que lo haga. Porque dijo que los niños actores son unos mocosos mimados. Mi pregunta es, ¿alguna vez trabajas con niños? Y es mi mamá, ¿verdad?"
"Hey, Sarah, is your friend Mark, longtime fans love your comedy. I think we’re getting better every year. Please don’t ever stop.","Hola, Sarah, soy tu amigo Mark. A los fans de toda la vida les encanta tu comedia. Creo que estamos mejorando cada año. Por favor, nunca te detengas."
"Thanks, Mark.","Gracias, Marcos."
"Just listened to your recent podcast with the call from the listener who’s having trouble with gas as a result of a botched surgery some 47 years ago. And yeah, that’s a tricky one. But at the end of your little segment on this, you said I’m sure my listeners will be calling in and well, I’m one of them.","Acabo de escuchar su reciente podcast con la llamada de un oyente que tiene problemas con los gases como resultado de una cirugía fallida hace unos 47 años. Y sí, esa es complicada. Pero al final de tu pequeño segmento sobre esto, dijiste: Estoy seguro de que mis oyentes te llamarán y bueno, yo soy uno de ellos."
"Oh, good.",Oh Dios.
"I googled the problem and found a solution at least a partial solution. And that is a product called tootles TOOTLES thought it was a funny name. And I knew it would resonate with you […] it is underwear both for men and women that has a charcoal filter built into the back. I don’t think it’ll handle the noise aspect. But it should certainly address the smell. So if she could manage to adjust her rump in a way to minimize the vibration, then tootles should take care of the rest. I hope this helps love you.","Busqué en Google el problema y encontré una solución, al menos parcial. Y ese es un producto llamado Tootles. A TOOTLES le pareció un nombre gracioso. Y sabía que resonaría en ti […] es ropa interior tanto para hombres como para mujeres que tiene un filtro de carbón incorporado en la parte posterior. No creo que aguante el aspecto del ruido. Pero ciertamente debería abordar el olor. Entonces, si ella pudo ajustar su trasero de manera que minimizara la vibración, entonces Tootles debería encargarse del resto. Espero que esto ayude a amarte."
"You know, I was sent a link to charcoal underwear by Jimmy Kimmel years ago and he’s like, dude, you should get this first of all, I don’t pass much gas and if I do, it never smells. If it does, it’s maybe because I’m like really sick or something like but it doesn’t, you know, but anyway, not that there’s anything wrong with that. But that was always like a thing with him and me he would anyway that’s ridiculous. I don’t do that. But um I so I am a little bit familiar with her charcoal underwear, it doesn’t muffle any sound. It’s just that the smelly air passes through it and the charcoal like cleans the smell or something. That’s not the technical answer, obviously. Anyway, thanks Mark, Tootles underwear. I don’t know if it’s, she didn’t mention it smelling but that’s definitely a good to know. All right, what else?","Sabes, Jimmy Kimmel me envió un enlace a ropa interior de carbón hace años y me dijo, amigo, primero deberías conseguir esto, no expulso muchos gases y, si lo hago, nunca huele. Si es así, es tal vez porque estoy muy enfermo o algo así, pero no es así, ya sabes, pero de todos modos, no es que haya nada malo en eso. Pero eso siempre fue algo entre él y yo. De todos modos, eso es ridículo. Yo no hago eso. Pero estoy un poco familiarizado con su ropa interior color carbón, no amortigua ningún sonido. Es solo que el aire maloliente pasa a través de él y el carbón limpia el olor o algo así. Obviamente, esa no es la respuesta técnica. De todos modos, gracias Mark, ropa interior de Tootles. No sé si lo es, ella no mencionó el olor, pero definitivamente es bueno saberlo. Muy bien, ¿qué más?"
