Text_Chunks,Translation_to_SPA
"I Sarah, my name is John and I’m calling I just listened to your episode being girlfriend roof, roof feed, and I was very title running to the caller who was having what’s called fecal incontinence due to an accident and the seven days. It’s very common and it’s horrible that she has to think endure this alone, I too had the same problem due to radiation from lymphoma located in my lower region. I was put in touch with a colorectal doctor and he did something called a neuromodulation stimulator. And what it’s doing is it retrained, think of like those nerves, it’s the sacral nerve. And when the sacral nerve is damaged, think of it like a plant that is frozen at winter and it just dies back and when it gets to a certain level of dying back, it no longer works and you develop those type of symptoms. But the neuro modulator stimulator go stimulator is a surgically implanted device very similar to like a pacemaker for your heart. It’s a pacemaker for your poop, and it stimulates the sacral nerves, and I had 100% success with it and now I go about life not looking for a bathroom or.","Yo, Sarah, mi nombre es John y estoy llamando. Acabo de escuchar tu episodio sobre el techo de la novia, la alimentación del techo, y estaba muy interesado en dirigirme a la persona que llamó y que tenía lo que se llama incontinencia fecal debido a un accidente y a los siete días. Es muy común y es horrible que ella tenga que pensar aguantar esto sola, yo también tuve el mismo problema por la radiación de un linfoma localizado en mi región inferior. Me pusieron en contacto con un médico colorrectal y me hizo algo llamado estimulador de neuromodulación. Y lo que está haciendo es volver a entrenarlo, piense en esos nervios, es el nervio sacro. Y cuando el nervio sacro está dañado, piense en él como una planta que se congela en invierno y simplemente muere y cuando llega a un cierto nivel de muerte, ya no funciona y desarrolla ese tipo de síntomas. Pero el estimulador neuromodulador go stimulator es un dispositivo implantado quirúrgicamente muy similar a un marcapasos para el corazón. Es un marcapasos para tu caca y estimula los nervios sacros, tuve 100% de éxito con él y ahora sigo con la vida sin buscar un baño o."
"We should sacral nerves stimulator wonder if that’s covered by insurance, it certainly shouldn’t be for her. Sacral nerve stimulation is covered for the treatment of urinary urge incontinence urgency frequency syndrome and urinary retention. No but oh and fecal incontinence, incontinence? Is it covered by insurance? For ongoing therapy, the cost of the sacral nerve stimulation surgical implant was $22,970. Well, we should let her know about it. Maybe her insurance covers it. God, insurance, this whole racket of health care Gosh, darn it. I don’t want to get into it but anyway, thank you, John, for calling in. Let’s pass that information on. We have another one about this passing gas. Let’s see.","Deberíamos preguntarnos si eso está cubierto por el seguro, ciertamente no debería serlo para ella. La estimulación del nervio sacro está cubierta para el tratamiento del síndrome de frecuencia de urgencia y de incontinencia urinaria de urgencia y la retención urinaria. No pero ah y la incontinencia fecal, ¿incontinencia? ¿Está cubierto por el seguro? Para la terapia en curso, el costo del implante quirúrgico de estimulación del nervio sacro fue de $22,970. Bueno, deberíamos hacérselo saber. Quizás su seguro lo cubra. Dios, seguros, todo este escándalo de la atención médica. Dios, maldita sea. No quiero entrar en detalles, pero de todos modos, gracias John por llamarnos. Pasemos esa información. Tenemos otro sobre este gas que pasa. Vamos a ver."
"Hey, Sarah, my name is Zoey. I first time caller. I just love and appreciate you so much. I have so many things to say. But specifically, I just listened to the episode about the lady who has you know, unintentional farts, and it sounds like.","Hola, Sarah, mi nombre es Zoey. Llamo por primera vez. Simplemente te amo y te aprecio mucho. Tengo tantas cosas que decir. Pero específicamente, acabo de escuchar el episodio sobre la dama que, ya sabes, se tira pedos involuntarios, y suena así."
Everyone’s way of describing it.,La forma que cada uno tiene de describirlo.
"And I guess I was thinking what she could say would be something like I have a medical problem, that’s likely to happen again. Because we’re human, it’s okay to laugh and say it in a serious way so it’s not like you’re really inviting laughter but just taking the forbidden aspect out of the laughter makes it actually live maybe less likely to happen. And just that we can all move on from that. I’m a nurse, I’m a hospice nurse. I just want to thank you so much from deep deep in my heart from for sharing your experiences with your the death of your dad and your stepmom there was so there was so much that so much I’m thankful for. And also last episode, I was, you talked about hearing loss. You talked about poor eyesight. I think you’ve met mentioned granny panties. There was some other very geriatric topic, and I’m I’m myself I’m 47 and I’m just so happy that to be you know, going through this time of life with you, thanks.","Y supongo que estaba pensando que lo que ella podría decir sería algo así como que tengo un problema médico, que es probable que vuelva a suceder. Debido a que somos humanos, está bien reír y decirlo de manera seria, así que no es como si realmente estuvieras provocando la risa, pero simplemente quitar el aspecto prohibido de la risa hace que sea realmente vivo y tal vez sea menos probable que suceda. Y simplemente todos podemos seguir adelante a partir de eso. Soy enfermera, soy enfermera de cuidados paliativos. Solo quiero agradecerte mucho desde lo más profundo de mi corazón por compartir tus experiencias con la muerte de tu papá y tu madrastra, hubo tantas cosas por las que estoy agradecido. Y también en el último episodio hablaste sobre la pérdida de audición. Hablaste de problemas de visión. Creo que conociste las bragas de abuela mencionadas. Hubo otro tema muy geriátrico, y yo soy yo mismo, tengo 47 años y estoy muy feliz de poder estar, ya sabes, pasando por este momento de la vida contigo, gracias."
"I love that, it’s like it is true. It’s like we’re all like everyone in our age group is like going through it together, it’s like I remember hearing about like, Steve Martin and Martin Short and or like a bunch of comedians that all scheduled their colonoscopies like on the same day and then did prep together and played poker and just took turns like running to the bathroom together. And I just like it’s so there’s something very sweet about that.","Me encanta, es como si fuera verdad. Es como si todos en nuestro grupo de edad estuvieran pasando por esto juntos, es como si recordara haber oído hablar de Steve Martin y Martin Short y/o de un grupo de comediantes que programaron sus colonoscopias para el mismo día y Luego se prepararon juntos y jugaron al póquer y simplemente se turnaron para correr juntos al baño. Y simplemente me gusta, hay algo muy dulce en eso."
"Hi, Sarah. I’m calling again from Barcelona. My name is Presley. Soy artista, and my previous question was about your famous dish that you would cook you may be featured in my cookbook, Sarah Silverman, very random great not special. My next question is I’m currently drawing a series based on Legendary establishments around the world. I was in LA over Christmas and I, I drew a few places for example, in of the sevens array, Casa Vega, El Compadre […] set Tower Hotel and I just wanted to know what is a legendary bar or restaurant to you? Where is the most legendary spot that I can draw in LA? Thanks a lot, bye.","Hola Sarah. Vuelvo a llamar desde Barcelona. Mi nombre es Presley. Soy artista, y mi pregunta anterior fue sobre tu famoso plato que cocinarías. Quizás aparezca en mi libro de cocina, Sarah Silverman, muy aleatorio, genial, no especial. Mi siguiente pregunta es que actualmente estoy dibujando una serie basada en establecimientos legendarios de todo el mundo. Estuve en Los Ángeles durante la Navidad y dibujé algunos lugares, por ejemplo, en el grupo Sevens, Casa Vega, El Compadre […] en el Tower Hotel y solo quería saber qué es para ti un bar o restaurante legendario. ¿Dónde está el lugar más legendario que puedo dibujar en Los Ángeles? Muchas gracias, adios."
"I mean LA is so many things, but for some reason I thought of Joan’s on Third just because I do think its aesthetic is so beautiful and I could see it drawn but Joan’s on Third is the restaurant on on third Street and it’s it’s just beautiful. It’s like there isn’t even a lot of can eat there but it’s so good. It’s just beautiful. It looks like it looks like the kitchen in every Nancy Meyers movie like I have to believe she bases her kitchens, her movie kitchens on Joan’s on Third there’s something about it, that’s like so reminds me of of any, any characters like gorgeous kitchen and a Nancy Meyers movie. Do you know what I mean? Amy?","Quiero decir, Los Ángeles es tantas cosas, pero por alguna razón pensé en Joan's on Third solo porque creo que su estética es muy hermosa y pude verlo dibujado, pero Joan's on Third es el restaurante en Third Street y es simplemente hermoso. . Es como si ni siquiera hubiera muchas latas de comer allí, pero es muy bueno. Es simplemente hermoso. Parece que se parece a la cocina de todas las películas de Nancy Meyers. Tengo que creer que ella basa sus cocinas, las cocinas de sus películas en Joan's on Third. Hay algo en ello que me recuerda a cualquier personaje, como Gorgeous Kitchen y una película de Nancy Meyers. ¿Sabes lo que quiero decir? ¿Amy?"
"Yeah, I love that idea. And I could add a few.","Sí, me encanta esa idea. Y podría agregar algunos."
"Go on, yeah. Amy born and raised LA. So she would mean.","Continúe, sí. Amy nació y creció en Los Ángeles. Entonces ella querría decir."
"You mentioned Cantor’s, which is obviously a staple.","Mencionaste Cantor's, que obviamente es un alimento básico."
"Can’t wait, did I mentioned Cantor’s?","No puedo esperar, ¿mencioné el de Cantor?"
You mentioned in an answering another question when you said you were at Cantor.,Mencionaste al responder otra pregunta cuando dijiste que estabas en Cantor.
"Oh, yeah, Canter’s, God.","Oh, sí, Canter's, Dios."
"I would say any of the delis like a Nate now, a Canter’s. I also would say that LA Los Angeles is known for its Googy establishments, which is like a mid century kind of like the way that norms looks or those old diners.","Yo diría que cualquiera de las delicatessen ahora es como un Nate, un Canter's. También diría que Los Ángeles es conocido por sus establecimientos Googy, que son como de mediados de siglo, parecidos a la apariencia de las normas o de esos viejos comensales."
And there’s Johnny’s that’s basically just for films.,"Y está Johnny's, que es básicamente solo para películas."
"But there’s the one that’s over on the way to the airport. That’s a really cool one. And there’s quite a few diners that still exist, I would say the original Bob’s Big Boy, in Burbank.","Pero está el que está camino al aeropuerto. Esa es realmente genial. Y todavía existen bastantes restaurantes, yo diría que el Bob's Big Boy original, en Burbank."
"God, you’re killing this.","Dios, estás matando esto."
"Something to maybe look at. I mean, that’s just restaurants, and then in terms of bars, you know, some of the oldest bars are.","Algo que quizás mirar. Quiero decir, son solo restaurantes, y luego, en términos de bares, ya sabes, algunos de los bares más antiguos lo son."
The Formosa?,¿La Formosa?
"The Formosa or the Trocadero, which is like from the 20s. I would also argue like the Comedy Store, which is, you know, been around since the 20s, when it was cero or ciros. There’s a lot of like, historic stuff on Sunset Boulevard and old buildings that you if you drive by, you wouldn’t even notice that they were old, like like the gill Turner’s for example, that liquor store that’s like on the corner.","El Formosa o el Trocadero, que es como de los años 20. También diría que Comedy Store, que, ya sabes, existe desde los años 20, cuando era cero o ciros. Hay muchas cosas históricas en Sunset Boulevard y edificios antiguos que, si pasas por allí, ni siquiera te darías cuenta de que son viejos, como Gill Turner's, por ejemplo, esa licorería que está en la esquina."
On Sunset?,¿Al atardecer?
"So I don’t know there’s quite a few cool places like old divey bars, like there was a place near where Kennedy, R F. Kennedy was shot. And it’s called the HMS bounty. It’s one of the oldest bars is kind of near Cape Town. It’s a really cool place, and then you know, there’s like Felipe downtown and there’s a lot of cool places downtown Langurs, I try to look at Langurs, too, which is an old school Deli.","Así que no sé, hay bastantes lugares interesantes, como viejos bares de mala muerte, como si hubiera un lugar cerca de donde le dispararon a Kennedy, R F. Kennedy. Y se llama recompensa del HMS. Es uno de los bares más antiguos que se encuentra cerca de Ciudad del Cabo. Es un lugar realmente genial, y luego, ya sabes, está Felipe en el centro y hay muchos lugares interesantes en el centro de Langurs. También trato de mirar a Langurs, que es una tienda de delicatessen de la vieja escuela."
"Oh my god, this is the best answer ever given on this podcast.","Dios mío, esta es la mejor respuesta jamás dada en este podcast."
"Wow, thank you. I’m Angelina proud Angelina and a historic preservation Commissioner West Hollywood so.","Wow gracias. Soy Angelina, Angelina orgullosa y comisionada de preservación histórica de West Hollywood."
That’s right.,Así es.
Very invested in preserving old Hollywood.,Muy interesado en preservar el viejo Hollywood.
"I love it. Yeah, there is so much even just like the Du-par’s at the grove. That old Farmers Market.","Me encanta. Sí, hay muchas cosas como las de Du-par en el bosque. Ese viejo mercado de agricultores."
"Absolutely, Du-par’s,  is like a very untouched I mean, it’s still got those maroon booths. And and the farmers market itself is would be equally as good.","Absolutamente, Du-par's, es como un lugar muy intacto, quiero decir, todavía tiene esas cabinas granate. Y el mercado de agricultores en sí sería igualmente bueno."
"Yeah, Bob’s donuts. Well, we we watched Bosch or I was away and Rory watched Bosch. I had watched it because I just like needed something to why it’s good. And dad’s love Bosch, but um, Rory, when he moved out here I was then on you know, working out of town for like three months and he watched Bosch and then like went to all the LA because it takes place in LA and he’ll be like, this was the best I went to so and so’s the hole in the wall where you get the best bagels in LA or whatever. And he would go to all of those like Bosch tour. All right, what else?","Sí, las donas de Bob. Bueno, cuidábamos a Bosch o yo estaba fuera y Rory observaba a Bosch. Lo había visto porque simplemente necesitaba algo que explicara por qué es bueno. Y a papá le encanta Bosch, pero, Rory, cuando se mudó aquí yo estaba entonces, ya sabes, trabajando fuera de la ciudad durante unos tres meses y él vio a Bosch y luego se fue a todo Los Ángeles porque tiene lugar en Los Ángeles y él Seré como, este fue el mejor lugar al que fui y ese es el agujero en la pared donde consigues los mejores bagels de Los Ángeles o lo que sea. Y él iría a todas esas giras como las de Bosch. Muy bien, ¿qué más?"
"Hello, Sarah, my name is Yasmine, everyone calls me Yas. I work for a beauty company in Canada that’s also very popular in America. Black and white stripes if you get my drift. I don’t actually even know if I can legally say I worked there but whatever. You were talking about stamp eyeliner. The brand is called Kaja, KAJA, and they make this like really, really cute little Stampee. And you just do it a little corner of your eye and a little wing and it’s part Perfect and adorable and cute and it’s all one thing and it’s from a Korean company called Kaja. They also make really cute little blushes that are little compacts and bento box face products as well. They’re just adorable. So I hope that helps. Love you girl, you don’t even make up anyways, yeah.","Hola Sarah, mi nombre es Yasmine, todos me llaman Yas. Trabajo para una empresa de belleza en Canadá que también es muy popular en Estados Unidos. Rayas blancas y negras, si me entiendes. En realidad ni siquiera sé si puedo decir legalmente que trabajé allí, pero da igual. Estabas hablando del delineador de ojos con sello. La marca se llama Kaja, KAJA, y lo hacen como un pequeño Stampee realmente lindo. Y simplemente lo haces con el rabillo del ojo y una pequeña ala y es parte Perfecto, adorable y lindo, y es todo una cosa y es de una empresa coreana llamada Kaja. También hacen pequeños rubores realmente lindos que son pequeños compactos y también productos para el rostro de caja bento. Son simplemente adorables. Así que espero que eso ayude. Te amo niña, de todos modos ni siquiera te maquillas, sí."
"I wrap things. Yes, I think I saw that, or did you send that to me, it’s me. It’s like, it gives you the the cat I corner little triangle and then you fill in the rest. But the part that you fill in the rest is the part that I have the problem with, which is like staying on the line above my eyelid, you know, and like making a thick line.","Envuelvo cosas. Sí, creo que vi eso, o me lo enviaste, soy yo. Es como si te diera el pequeño triángulo del gato que arrinco y luego completas el resto. Pero la parte que completas el resto es la parte con la que tengo el problema, que es como permanecer en la línea sobre mi párpado, ya sabes, y como hacer una línea gruesa."
"So usually, I mentioned that there was like a stamp when you mentioned it on the last show, but what you can do is just do like a dark shadow, so that it’s sort of a little smoky and then just use that stamp at the end.","Por lo general, mencioné que había como un sello cuando lo mencionaste en el último programa, pero lo que puedes hacer es simplemente hacerlo como una sombra oscura, para que tenga un poco de humo y luego usar ese sello al final. ."
"Oh, that’s what I started doing is I put like, I use like a dark shadow instead of a pencil and it’s just like you can mess it up a little more and then you just fix it with the Q tip.","Oh, eso es lo que comencé a hacer: puse una sombra oscura en lugar de un lápiz y es como si pudieras estropearlo un poco más y luego simplemente arreglarlo con el Q tip."
"Victoria Beckham’s Kajal, her she has KAJAL liners. First of all her makeup is amazing.","Kajal de Victoria Beckham, ella tiene forros KAJAL. Primero que nada su maquillaje es increíble."
It is?,¿Es?
"Oh my gosh, and it’s clean beauty and I the liners are insane. And she also has these cream shadows in a stick and there’s probably a like I use a dark brown but I was gonna actually suggest maybe there’s a darker one that you could use for this as well like what you’re looking for.","Dios mío, es una belleza limpia y los delineadores están locos. Y ella también tiene estas sombras en crema en una barra y probablemente haya una como yo uso un marrón oscuro, pero en realidad iba a sugerir que tal vez haya una más oscura que podrías usar para esto, así como lo que estás buscando."
"Yeah, but you use the dark brown to line your lips don’t you know.","Sí, pero usas el marrón oscuro para delinear tus labios, ¿no lo sabes?"
I use her dark brown on my under my eyes and over my eyes to kind of make my whole eye look reddish because I have green eyes and that purples and reds pops green.,Utilizo su marrón oscuro debajo de mis ojos y sobre mis ojos para hacer que todo mi ojo luzca rojizo porque tengo ojos verdes y los morados y rojos resaltan en verde.
What the fuck? How do you know these things?,¿Qué carajo? ¿Cómo sabes estas cosas?
I’ve been into makeup like my whole life. I’m good at doing makeup.,Me ha gustado el maquillaje toda mi vida. Soy buena maquillando.
Well fun fact about Amy’s V is she uses a black eyeliner on her lips. And that’s her only lipstick.,Un dato curioso sobre Amy's V es que usa un delineador de ojos negro en los labios. Y ese es su único lápiz labial.
But everybody that grew up in LA in the 90s did that. It just happened to stick with me.,Pero todos los que crecieron en Los Ángeles en los años 90 hicieron eso. Simplemente se quedó conmigo.
I know it looks good.,Sé que se ve bien.
But no one would ever know it was black. It just looks like I’ve got like a nice deep purple or something.,Pero nadie sabría jamás que era negro. Parece que tengo un bonito color morado oscuro o algo así.
"Yeah, I would be I was shocked when you told me and showed me. All right, what else?","Sí, me sorprendió cuando me lo dijiste y me lo mostraste. Muy bien, ¿qué más?"
"Hey, Sarah. It’s your best friend Amber calling from Sydney, Australia. This Saturday is the 46th annual Gay and Lesbian Mardi Gras in Sydney.","Hola, Sara. Soy tu mejor amiga, Amber, llamando desde Sydney, Australia. Este sábado se celebra el 46º Mardi Gras anual de gays y lesbianas en Sydney."
Wow.,Guau.
"And to celebrate, I would just love to say to the world that I am completely and utterly gay. I’ve lived the majority of my life as a heterosexual woman. Then a few years ago, I got more comfortable with the identity of pansexual because I found that myself getting attracted to some women and some non binary people. And then last year in 2023, I finally got the flaps to take the leap and start dating women and I have to say that it has been the most beautiful and rewarding experience of my life. The depth of connection and the level of intimacy through dating women has just been like, offered studies. And so if there’s anyone out there listening who was like me and was terrified, just go for it. Find that person that you’re attracted to and just fucking go for it. What have you got to lose? Love you.","Y para celebrarlo, me encantaría decirle al mundo que soy total y absolutamente gay. He vivido la mayor parte de mi vida como mujer heterosexual. Luego, hace unos años, me sentí más cómodo con la identidad de pansexual porque descubrí que me atraían algunas mujeres y algunas personas no binarias. Y luego, el año pasado, en 2023, finalmente conseguí las aletas para dar el salto y empezar a salir con mujeres y tengo que decir que ha sido la experiencia más bonita y gratificante de mi vida. La profundidad de la conexión y el nivel de intimidad a través de las citas con mujeres han sido ofrecidos por estudios. Entonces, si hay alguien escuchando que fuera como yo y estuviera aterrorizado, que lo haga. Encuentra a esa persona que te atrae y hazlo. ¿Qué puedes perder? Te amo."
