"On September 27, 2018, just about everyone I knew was glued to their TV screens as a woman wearing a blue suit walked into the Senate chamber to testify against Supreme Court nominee, Brett Kavanaugh. With a slew of photographers crouched in front of her, she raised her right hand and swore to tell the truth about what happened to her in the summer of 1982. She believed it was her civic duty to tell Congress that the man they were considering as the next Supreme Court justice had sexually assaulted her at a party when they were both teenagers. I for one, remember her testimony clear as day. I was stuck in a chair so much that summer and early fall nursing my baby who was born in May of 2018. And I vividly recall sitting in this salmon colored glider in my son’s nursery, watching this woman on my little iPhone screen, holding on to him and hanging on to her every word. Well, behind the images on the screen. Behind that blue suit was a real life human being a mother of two named Christine, a professor, a California resident, and a big fan of Soundgarden and Metallica. She’s someone who historically hasn’t gone by the formal three name moniker. We’ve come to know her by Christine Blasi Ford. She has been Dr. Blasi, we’re just Christine, even Chrissy to a select few. And she’s now the author of a new memoir called One Way Back, where she details the life she lived before that day in the Senate chamber and how she plans to keep living the version of it that she’s in now, on the other side. It’s a very different version of her life. One with security detail, and a dining room full of letters from 10s of 1000s of strangers. The underside of her hair is no longer dyed the vibrant blue she’d worn before her day in the Senate. Many of her relationships have changed, and she’s formed new ones, including with some of the most recognizable people in the world. Of course, these huge changes make Christine a perfect person to talk to about Last Days. So without further ado, this is Last Day, a show about the moments that change us. I’m your host Stephanie Wittels Wachs. Today, I give you the gift of Christine Blasi Ford."
"Hi."
"Hi, how are you?"
"Wow, you’re wearing a Metallica shirt."
"Can you see that?"
"Oh, fuckin’ love it."
"And pajama pants as well."
"Obsessed."
"Yeah."
"Oh, my God, yes. I just finished reading your book, I loved it so much. I just enjoyed you. And I’m thrilled to talk to you today."
"Oh, thank you so much. Let’s, I’m thrilled to meet you."
"So I want to start with the before times, actually, so it’s so funny you say before times you capitalize it like we do. And you right? I missed the simple determinations I used to make in the before times. And I’d love to get a sense of what your life was like in the before times."
"Sure, so I’m a university professor, and I teach statistics, which is this class that people don’t necessarily want to take but often have to take. So I try to make it as fun as possible and as educational as possible. It’s pretty challenging class. So I do that from September until May and in between I surf as much as I can. And then in the summer. I have the summer off to be with my kids."
"I feel like surfing is such a symbol in the book, right you in the water and what it means to you. And as someone who doesn’t surf but it’s surf curious. Could you kind of break down like surfing for dummies Crash Course why you love it and why you love the water and why you love surfing,"
"Sure, well, I love being in the water, especially the ocean and, and especially the Pacific Ocean with all of the biodiversity and the varying types of waves around every corner. It’s just something that I when I’m in the ocean, I feel really connected to other people who are in the ocean, even people who might be in the ocean far, far away, all at the same time so."
"Yeah, I love that. That’s yeah, that connectivity and like the bigness of it, you know, a lot of people are afraid of that bigness. But you seem to find a home in it."
"Yeah, I think I feel safer in the ocean than anywhere, but it’s it is a place to be mindful it is it can be dangerous. So you have to have some skills and some knowledge and make some decisions when you’re out there. So it’s both beautiful and a little bit scary."
"Beautiful and a little bit scary. Is that a place you kind of like to live?"
"It’s like, it’s scary part doesn’t get too out of control. And yes, it’s okay, that when you’re in the ocean, and it’s scary. What’s interesting is that you don’t really have the opportunity to panic or doubt yourself, you really have to make quick decisions and stay calm, like that’s one of the things that you’re taught for ocean safety is to stay calm so you don’t really have the same opportunity to get stressed out and panic and overthink everything. And that’s kind of nice to be a little bit contained in that way just because you’re managing oncoming waves, and there’s another one behind that. There’s other surfers and rocks, there’s all kinds of things that you need to be mindful of."
"Wow. So surfing was your hobby, obviously, your passion your pastime still is it sounds like but like you said, the thing you did for work was super smart academic work up in Palo Alto. And your teaching and research, I think is such an interesting backdrop for the events that have unfolded over the last five years, you speculate that you were able to keep the trauma of your assault under the surface for so long because of the objective statistics focused way that you’d been trained to kind of look at data and and there seems to be a real turning point in the story where you feel like you can’t hold this at bay anymore where this traumatic event can’t be kept at this distance any longer. And I’m wondering if you could talk about how that felt to sort of have those two different things colliding?"
"Yeah, so it was not as hard at the beginning as it became later on. And I think one thing that people don’t realize is that the process for me started three months before everyone saw me on TV so when Justice Kennedy retired, you know, I started having some thoughts about who might be the replacement and saw that news articles that mentioned Brett’s name, and was concerned and was operating on a pretty short timeline, because I think it had been announced that the nomination from this shortlist would be selected within a week or something, it was very short time period. So I felt really clear. And I was not anxious or stressed. But I was clear that I needed to say something, not necessarily to the whole world or on television, but that I needed to just say something to someone that was kind of the easier part is making that initial contact the first week of July."
"And listeners, I gotta tell you, things spiraled out of her control very quickly after that, you really do need to read her book to fully comprehend how nutty it was. But just to give you an idea, Christine says she initially talked with a few close friends about how to report this information, where to even begin, she contacted her state representative who put her in touch with Senator Dianne Feinstein, there was lots of back and forth with their respective staff. At some point, a few people encouraged her to get legal representation. When she got lawyers, those lawyers encouraged her to testify in front of Congress, that by the time she got comfortable enough with that terrifying prospect, her lawyers suddenly advised her against it. Politicians that Christine had been put in touch with kept changing their tune about how involved they want it to be, and by the time the summer came to a close, she had no idea if anything was actually going to be done. Then various details about her and her allegation leaked, articles were published and all of a sudden, a congressional testimony was back on the table and would need to happen stat."
"I really do appreciate how you, you drew this boundary in the book and you said if you want to read about what happened to me or the testimony, it’s all on public record. So I don’t even want to talk about that. What I would like to ask though is I think it’s really fascinating, like, the morning of a life changing moment. You don’t necessarily know what’s coming. I mean, you kind of did you, you were about to be put in front of a metaphorical moving train, in the Senate chamber, but you woke up that morning, and what was going through your head and what was what was going on in your body and anything like that, that kind of comes to mind about the before you went in and leading up to it?"
"Yeah, for sure, the day before is worse than the day of I think with any stressful thing in life, it’s kind of like that with a doctor’s appointment or anything, or the day before is the worst. So the day of I woke up incredibly early, I got almost no sleep. And I just felt really ready, ready to get this done and be over, it had been three months of all kinds of wrangling and stress and meetings about going forward and meetings about not going forward. And that that morning, I woke up ready for this to come to an end. So I remember really clearly walking down the hallway, from the holding room to the committee room. So I remember that hallway forever. It was like it was in slow motion. The people standing in their doorways and waving at me and looking at me, and then coming into the committee room with my bodyguard, and getting to that table and chair, and then all the photographers kind of jumping up and snapping photos."
"Do you swear that the testimony you’re about to give before this committee will be the truth, the whole truth and nothing but the truth? So help you God, thank you very much."
"I mean, the cameras clicking is such a visceral image. And I’m wondering, like, as you emerge out of that, what do you remember feeling and thinking sort of immediately after, right? You’ve there snapping and you’ve been grilled? And there’s all this talk between the senators and you walk out, and what is your thought?"
"My thought was, that went okay, I’m okay. I’m going to be okay. And I’m going to go home and go back to California and hopefully soon be able to move out of the hotel we were living in and go back to our house and go back to work when I could. So I came out of the hearing, you know, intact, I survived it pretty well, it didn’t seem that terrible. It wasn’t my preference to have all those cameras or to have it be so public. But I didn’t know that it was going to be that public and that everyone was going to be watching it. And in a way that served me."
"I think it’s so interesting to think about that identity shift, right of like, you know, Christine, private Christine, and then push like household name, Christine."
"Yes."
"That is a major shift that I don’t think a lot of people can speak to. What do you remember about that time?"
"I remember a lot of people contacting me and wanting to speak with me media, citizens, famous people. And I felt like I just needed a lot of time to come to terms with what was happening, the level of media and the level of coverage. And finding out how many people had watched it and hearing my very painful story about high school I. Yeah, it was very sudden, and people, even in my most inner circle, were sort of responding to me differently, so."
"How so?"
"Just like some people seem to be a little bit in awe of me. And I think that’s one of the reasons I wrote the book is, you know, I heard from a lot of people I got correspondence from people all over the world. All 50 states 42 countries, and I think some people you know, obviously some people kind of demonized me but a lot of people idolized me and part of wanting to write the book was just to share that I’m just a person and a lot of people saying they could never do what I did and I wanted to let them know that I could never do what I did either so."
"Right, and you know when you’re this is a quick personal tangent but when you’re when you’re nursing I don’t know if you nurse your your kids, but like yes, you’re you’re in that just hole where you’re just like a cow. You’re just like, just like, cut off from the world in a different kind of a way."
"Yeah."
"I was nursing my son, when you were going through this, and I remember viscerally and vividly sitting in the chair, watching you and like, it makes me overwhelmed like being so in awe of what you were able to do."
"My motivation and coming forward was to be helpful. And to provide facts about how Mr. Cabinets actions have damaged my life. So that you could take into a serious consideration as you make your decision about how to proceed. It is not my responsibility to determine whether Mr. Kavanaugh deserves to sit on the Supreme Court. My responsibility is to tell you the truth."
"I think it was true for so many people who watched you that you, you suddenly like became the symbol which you talked about in the book, would you have gone through this like had you known like I was going to, you know, become this thing that people were going to do to attach meaning to and symbol to? That seems like a lot of pressure for someone who was just trying to do the right thing?"
"Right, yeah, I think beforehand, when you’re wrangling with something like this, and people tell you there’s going to be backlash. And it’s not a concrete thing backlash. So you’re just imagining in your head, like, what is backlash? Does that mean, people I don’t know are gonna say bad things about me. Okay, that’s okay. That’s just a tree falling in a forest somewhere. I don’t need to worry about that. But I didn’t really know in a concrete way what the backlash was going to look like. And it probably that’s good that I didn’t know. But even now that I do know, know what people are capable of and what their intent is. I still don’t regret it and still would, would do it again. It’s survivable, and I want people to take that away from my account that yes, it was extremely difficult, very painful, went through a really long grief cycle. But it’s still important that we speak up."
"Yeah."
"If we want things to be different and better. Not everyone can speak up. There’s a lot of reasons why people can’t speak up. And I’ve heard from so many survivors, so I totally understand, but for those who want to hope this gives them some more concrete examples of what that aftermath might be like."
"One part of that aftermath is that Brett Kavanaugh did indeed get confirmed to the Supreme Court. Christine’s testimony was ignored, downplayed and doubted. After the confirmation people in her life tried to reassure her that she’d done the best she could and at least it was over now. She writes that she felt quote, misunderstood by everyone on the planet. She also writes poignantly about what this outcome meant for her understanding of the political system in general, a system she had been trying to help. I think what was so heartbreaking in the book, you, I’d like to quote you to you, if you if you’ll allow me."
"Sure."
"You say I was told that even if I had medical records describing the assault and identifying Brett as the attacker, as well as 20 people saying they’d been told about it years earlier. And actual videotape of him doing it would not have made a difference. Even with that video, they could have denied it was Brett on the footage. So since it takes your breath away, and then you write, every time more information came to light about Kavanaugh or the way that confirmation was handled various contacts in DC would tell me the harsh truth, there is zero chance that anything will be done."
"And that’s after, you know, months and months and months of grieving and that natural grief part of well, someone’s going to fix this and someone, some lawyer or politician or journalist is going to get all this information together about and expose, actually what happened or maybe there will be an investigation or you know, there’s these things that you go through with grief where you’re hoping for things to happen, hoping somebody’s going to fix it. And then when people start to say to you things like what you just said nothing is going to be done. You really do have to start moving into more of an acceptance phase, and it just took me a really long time to get there. I’m a long term griever takes me a long time to get over things. So I was slow griever I guess I take it slow."
"It was slow griever, yes, yeah but I think the thing that’s so interesting about that is that you expect you the sort of human, you expect that the right thing will happen, right? Like, I’m, I had good intentions. I’m a good person, I did the right thing for the right reasons."
"Surely yes, I mean, I was trying to be helpful. And I thought, this is helpful information. And all I’m saying is, maybe you should take another look at the people, the other people on the list who were possible candidates and maybe take a deeper look into, into Brett, I was called by a higher duty and civic duty and patriotism. And I assumed that that’s how people would treat me. And instead, it felt like the people I was trying to help actually hurt me, and did not help me so that was really difficult to come to terms with."
"Yeah, I think you write really eloquently about growing up in DC, and this being such a fundamental part of your understanding about how the world works, you grew up in the hub of American democracy. The machine was all around you. And you learned to respect government, and the system and the process and how it works for the people."
"Yes."
"Of which you are one. And I’d love to know, like, what would you say you did learn about this process of the reality of how the system actually works? And how much has that sort of shifted your belief and in the system injustice and all the things that that we sort of hold as our core tenets?"
"Yes. Well, I learned a lot about being an individual and trying to speak to the system and how complex that can be. I think George Washington said it in his farewell address something about like, something about how patriotism can’t override partisanships so once we have partisanship there, it’s really difficult to have patriotism. I hope I’m not butchering that farewell address, but I think it sounds great. But it’s he said something like that. So I think that I learned that that might be the state that we were in at the time. And maybe we’re still in that were a part, partisanship is sort of overriding any sense of civic duty patriotism. But nonetheless, we still need to keep trying. That’s important to keep trying."
"Perhaps even harder."
"Yes."
"We’re back. The weeks following Brett’s confirmation were devastating. After he was confirmed, Christine was still incredibly anxious and fatigued. Yet people were starting to move on. She was told there wasn’t much of a need anymore for the security guards she come to rely on, her calendar was suddenly totally empty, which for someone who loves their work, and learning and being around students felt like a void of purpose of social interaction. Everything that she knew and held dear was ripped out from underneath her."
"Yeah, that was those are hard times. So we had to reduce the security but it wasn’t safe enough for us to return to our house yet. So we’re still in hotels for several months. And I think we lived in four different places. So we were a little bit busy just because of that relocation and settling in and getting the kids to their schools, and to all their activities. And I wasn’t I just stayed inside. I didn’t go to those things. But making sure that they still got to go to school, I didn’t want them to have to miss their academic year. So I sought out my academic year. It wasn’t safe for me to go and I certainly didn’t want to put students at risk. Even if I could figure out a way to protect myself and have security for myself, it was just a little bit too much to try to strategize about how I could be in the classroom teaching so I set up for a year and actually set up for two years. So button now I’m back teachings."
"I’m so glad. I’m so glad to hear that. Yeah, it’s interesting, like we started talking about the ocean, the bigness of it. and suddenly your will got so small."
"Yeah, I just stared out the windows for so many hours and watched very micro level things happening, like trees and leaves and construction."
"Do you think that’s part of how you were able to make it through each day? Like how do you make it through each day?"
"Well, maybe we all got a taste of it in the pandemic, when we were inside, it’s a little bit similar to that, where suddenly you’re you’re inside and your regular life is not happening or your job is closed or has moved online. So it was, in some ways similar to that. And yeah, you find ways to pass the time, and I would get up in the morning, and after the kids would go to school, I would stay back with the security and, and just watch the surf channel, you know, all day long, and stare out the window and hope that we were going to move back home soon."
"How did your sons and husband interact with you during this time? I mean, were they worried about you? Were they you know, how were those interactions?"
"Well, during that after math period, I think that, you know, the kids certainly wanted to be back in their neighborhood. But they were, you know, kids are super resilient. So they were doing pretty well, and they were still going into school and seeing their friends. And, you know, I became like a really permissive parent, and I’m not a very permissive parents. So like, I just let them play Xbox, however long they wanted and have chocolate sundaes from room service for breakfast, or whatever they wanted to do to get through that time. So and then they got to see their friends and do middle of the week, sleepovers and, you know, there were times that we couldn’t all stay together, it wasn’t a good idea for us all to be in the same place so they would stay at different friend’s houses. And but yeah, they they definitely were more motivated to go back home. And I was I was a little bit more concerned about making sure that our house was a safe place and putting in, you know, various measures in our home that would help fortify us once we were we’re back here."
"Did you say that? Are my, am I making this up, am I projecting that you would like leave your doors open?"
"Yeah."
"Like did you think about security in you know, in the before times?"
"I never thought about that. I never I actually just thought they either just gonna dismiss me and be like, thanks for this information, bye or thanks for this information, we’ll do something about it and keep you posted or something, I didn’t know that it was going to be you know, not being able to be at home and needing a security detail for a while. But yeah, in the before times, we definitely had that house that anyone could just come in and come out the door opening and shutting all day with people coming in and out and playing basketball up front. coming inside and outside and all we’re all we’re welcome. And now our house is a bit of a fortress so it’s a little bit different now."
"Yeah, I have that house, not the fortress, the in and out the […] the door slam and constantly the doors and the footsteps and the running and the stairs and the yes, you know it’s it’s something a good time."
"I know […] I mean."
"You’re making me, I’m like, okay, I need to love this time. Is good and slow."
"Yeah."
"Okay, start surfing and love the slamming of the door constantly."
"Slamming of the door is hard to love, yeah, but you can get there."
"Oh, yes. Oh, yes. Yeah, I mean, I think that was sort of like the before and then these 10s of 1000s of letters. Yes, yeah, and some were threatening and violent, hence the fortress. But many others, the majority, the overwhelming majority were so deeply supportive."
"Beautiful. Yeah, just so incredible, just an incredible outpouring, and so different from the internet. I just wish everyone could have that part of the experience, because then you see how loving and wonderful people actually are. But if you go on the internet, you don’t see that. It was almost the opposite of what I saw on the internet in terms of proportion of hate and love. And, you know, 98% of the letters were incredibly loving. And the 2% that were were horrible. Were very, very horrible, very scary. And of the 98% that were were grateful for patriotism in our country and civic duty and citizenship. 24% of those were from survivors who told me their story. So those were heartwarming and heartbreaking. And I read them with a team of my students who are experts in trauma and work at our VA hospitals. You know, we just all kept feeling the same thing we have to write back to this person we had, you know, every letter you would read and be like, I just want to call that person and tell them something. And every letter felt that way, it was just this desire to respond. So yeah, still trying to figure out how to do that, but this book is one of the ways to try to, to honor those people for helping me survive, but also to, to honor what they’ve been through which many of them have been through so much worse. And they were so generous in sharing their supportive words, and."
"What an interesting intersection, you actually had a body of students trained in trauma, who could help you sort through them. And meticulously catalog in terms of data?"
