"Yes, it was sort of a way to make sense of the volume of letters. When the first batches were coming in, I thought, oh, I’m going to write every buddy back. I still wish I could do that, and I did start in on that I’ve written back to anyone over the age of 90, we started undoing that part. But it took so long that we quickly realized that was not a feasible way to respond. But yes, we formed a team. And we really, were just wanting to hear everyone, the way I was heard, I wanted everyone to be heard."
"But that’s an amazing. I mean, that’s wow, they shared with you so that you could hear them, right. I mean, it’s beautiful. There’s like this triumph of the human spirit stuff, where you’re like, holy shit, we are in this together. And it is powerful, isn’t it?"
"Very, very."
"Yeah, then it probably helped you to, you know, I would assume on your on your healing journey to I mean, the, the acceptance, the, you know, the grief, that you speak about so eloquently, it must have played into your ability to keep kind of putting one foot in front of the other."
"Definitely, yes. So I spent about a year reading the letters and still reading but I spent a year of full time reading the letters with my students and we were learning so much from survivors about their experiences that in a way that it can inform science and can inform clinicians working with trauma survivors, so just all so many different levels, the letters were really helpful, and especially helping me on my psychological process of of getting through through it all."
"Do you think that your work is going to be really tailored to this moving forward?"
"I don’t perceive it becoming like a new area of expertise where I would teach on that topic or something, it’s more of a of another type of work that I would want to get involved in in terms of helping other people who are trying to decide how to come forward and how to be safe. I want to be helpful in that area, for sure."
"It’s so beautiful, Christine, because your goal was to help. And you didn’t help in the way that you thought you would. But you are helping in this much bigger way that I’m sure you never could have imagined. I mean, I’ve heard you say multiple times today, I want to make it better for the next person. I want to make it better for the next person, and you are."
"Thank you, it’s got it’s taken a really long time for me to even see that it the first couple of years, I couldn’t see past like, all every minor incorrect thing that was said, and I just was, you know, kind of drowning in the information and the misinformation and the hate and all of that. But now I can see and I think it’s kind of interesting and ironic how badly I wanted the meeting to be private. Because I just I’m kind of afraid of cameras and I don’t really like my picture taken even like I just don’t like that camera part of all of it. And so, if I had gotten if I had gotten my way, and I had written a letter to the head of the committee say thing for his family and for my family. I think this really would be a better idea to have a private meeting. It wouldn’t have been helpful, I guess."
"It’s true."
"And yeah, that’s kind of interesting."
"That’s the bummer. That’s the that’s the bummer."
"The great thing."
"I mean, I mean, yeah, not the same story, but lost my brother to heroin overdose was like, Oh, my God, and then got so deep into addiction work and figuring out like, why are we losing so many people? Why is this an epidemic? How can how I did 26 episodes on opioids, how can I understand what happened? And people would say, like, but you’re helping so many people, I was like, I don’t fucking want to. I was like, Tim back. I don’t this sucks. This is a horrible alternative."
"I felt that way for a long time. I mean, I’m only now able to, it’s a long, it’s a long road, as you know, it’s just a really long road, and wow, that’s amazing, you did all that work. I don’t know that I could have done that."
"You know, you could this is the thing, like I felt the same. Like, it’s that thing of like, I couldn’t yes, you can, you know, you, it’s like very selfish in the beginning, how can I understand this more? But then it really is like, how can we all do better in this arena? Can I ask you a few more questions?"
"Yes."
"Okay, great, okay. Um, this Anita Hill, quote, was so resonant. Where you talk about seeing Anita Hill and then meeting her after your testimony, and her telling you to give it five years? And it’s been five years?"
"Almost six, I mean."
"Wow, I know."
"That almost like I guess it’s five and a half. Because I think of the start as being June 27, so yeah."
"And I’m wondering, like, how would you say that you’ve been changed by all of this by you know, by the passing of time, like you’ve given it five years, you just spoke to it beautifully about, I didn’t used to be able to see the forest for the trees, about the helping and all of that. And I think it’s really helpful for people to hear like, time does pass, it does change. Can you speak to that?"
"Yeah, I think that in that grieving process, where you just get to the point where you just think it’s not, I’m never going to be okay, again, like, I will never be okay, again. And right, it’s, like, unacceptable at first, and you just don’t want it to be that way. But as soon as you like, accept that, that, yes, you’re never going to be the same again, it’s, it’s not going to be the same. So once I started really accepting that is when I started to, to get better. And because before that, I just wanted it to be fixed, whatever that meant. So, but I think the really great thing is we can all rebuild our lives. And we’ve, a lot of us have had to rebuild our lives, like you’ve talked about with your own life, and a lot of people we all go through losing people that we love and various grief cycles. But there’s something about us that we’re wired to only suffer for so long. So I was pretty committed to the suffering path. I was on that path and just thought that’s how it’s going to be forever. And I’m like, just going to manage my grief and, and keep going and always be not okay. And, and then suddenly, like it starts to abate and and then you get to say, okay, well, what do I want my life to look like now? How do I build my life now? It’s this terrible thing, and it’s like this gift and you also wish you could give that gift to other people, without them having to go through the horrible parts, where you get to then decide, who do I want to hang out with? How do I want to spend my time and it makes everything really clear so I felt like I was given all this clarity, right? Like, I’ve changed, where I spend my time I change, I’ve changed my surf spot, I go to a different place. I’ve just made all these changes that I’m sure I would not have made. I would have just like kept complaining about or something, literally. So I made those changes, and now I just I live, I think a much more simple life and a much more minimalist life, and that’s working really well for me."
"I mean, you just essentially said exactly what I wrote in the epilogue of my book, which was when you go through something like this, it’s like your house is blown up, torn to bits and you’re just like sitting on this pile of rubble. And then you do realize at some point, okay, I have to rebuild. But what do I want to build, now? Like intentionally? What do I want it to look like? Like all that kind of and it’s like you say, can people do that without going through some sort of trauma? I don’t know, there’s a clarifying piece of it. That’s like, yeah, and that is universal. Like you’re talking about the same exact experience."
"Right, like in our crisis, we have opportunity."
"Yeah, and you got to meet Oprah. And you didn’t just meet her, Christine. You got to stay at her house."
"She’s so nice. Oh my gosh, and she can drive that golf cart so well, I was scared she was driving so well."
"There’s even more LAST DAY with Apple premium subscribers get exclusive access to content like behind the scenes chats with the producers of the show, diving deeper into episodes. Sign up now on Apple podcasts. LAST DAY is a production of Lemonada Media. The show is produced by Kegan Zema, Aria Bracci, and Tiffany Bui. Our engineer is Brian Castillo. Music is by Hannis Brown. Steve Nelson is our Vice President of weekly content and production and Jackie Danziger is our Vice President of narrative content and production. Executive Producers are Jessica Cordova Kramer and me Stephanie Wittels Wachs. If you’d like what you heard today, we have three other seasons that you can check out. Have a story you’d like to share, head to bit.ly/lastdaystories, or click the link in the show notes to fill out our confidential Google Form. follow and subscribe wherever you get your podcasts or listen ad free on Amazon music with your Prime membership. You can find us online at @LemonadaMedia and you can find me at @WittelStephanie. Thank you for listening, we will see you next week."
