Idiom,Meaning,Idiom_NEU,Idiom_NEG,Idiom_POS,Meaning_NEU,Meaning_NEG,Meaning_POS
como Dios manda,the way it's supposed to be,0.08252889662981033,0.42192110419273376,0.4955499470233917,0.005280683282762766,0.5678466558456421,0.4268726110458374
como perro en barrio  ajeno,out of place; in the wrong neighborhood (lit.: like a dog in  a distant neighborhood; i.e.: people who try to enter other parts of society  may be attacked or ostracized),0.5407540798187256,0.4214656352996826,0.03778032585978508,0.9262452721595764,0.07147766649723053,0.002277014311403036
como quitarle un pelo  al gato,a victimless crime (lit.: like removing a hair from a cat;  i.e.: the quantity in question is so small that it has no significant effect  and goes unnoticed),0.38085681200027466,0.5578157901763916,0.061327386647462845,0.7973926067352295,0.19937483966350555,0.0032324485946446657
como si no fuera poco,as if it were not enough,0.30556005239486694,0.5530269145965576,0.14141298830509186,0.2793996334075928,0.6952134370803833,0.025386905297636986
como siempre,as usual; as always,0.2737387418746948,0.5802926421165466,0.14596860110759735,0.2603115141391754,0.6945551633834839,0.045133307576179504
como un oro,like new (lit.: like a gold [coin]),0.1366218477487564,0.599867045879364,0.26351112127304077,0.0035346655640751123,0.7230480313301086,0.27341729402542114
como un perro,like a dog; like scum; in the gutter (lit.: like a dog),0.20893584191799164,0.5006841421127319,0.29038006067276,0.9714568853378296,0.025065828114748,0.0034772770013660192
como una balsa de  aceite,smoothly; swimmingly; peacefully (lit.: like a pool of oil),0.49991685152053833,0.43427425622940063,0.06580890715122223,0.0022310293279588223,0.25703418254852295,0.7407347559928894
como una rosa,fresh as a daisy; soft as silk (lit.: like a rose),0.10144799202680588,0.5742148160934448,0.3243372142314911,0.0019129769643768668,0.12103642523288727,0.8770505785942078
con anticipación,in advance; ahead of time,0.05633118003606796,0.810254693031311,0.1334141492843628,0.004250645637512207,0.72596675157547,0.2697826027870178
con apuros,with difficulty,0.7349275350570679,0.24368968605995178,0.021382777020335197,0.18596883118152618,0.7901931405067444,0.023838018998503685
con pelos y señales,in minute detail; precisely,0.2248794138431549,0.6472240090370178,0.12789662182331085,0.009659143164753914,0.963351845741272,0.026988936588168144
con permiso,with (your) permission,0.18118269741535187,0.686176598072052,0.13264070451259613,0.005355346482247114,0.9318928718566895,0.06275175511837006
con seguridad,surely; certainly; absolutely,0.1585194170475006,0.6984004378318787,0.14308008551597595,0.003087962744757533,0.23777087032794952,0.7591412663459778
con toda la barba,real; the real deal; honest to goodness; true (lit.: with  all the beard),0.03175404667854309,0.5203741192817688,0.44787177443504333,0.0023093337658792734,0.23628965020179749,0.7614010572433472
con todo respeto,with all due respect.,0.1500132977962494,0.6449434757232666,0.20504319667816162,0.0032346216030418873,0.19606809318065643,0.8006972670555115
consultarlo con la  almohada,sleep on it (lit.: consult about something with the pillow),0.05532488599419594,0.8296034336090088,0.11507172882556915,0.007522616535425186,0.9712872505187988,0.021190054714679718
contar con,count on,0.21760500967502594,0.5968397855758667,0.18555518984794617,0.013841701671481133,0.8611007332801819,0.12505760788917542
correr la bola,spread the word; put out the word,0.2015172392129898,0.5646087527275085,0.23387403786182404,0.005170229356735945,0.7442951202392578,0.25053465366363525
cortar el bacalao,call the shots (lit.: to cut the codfish; n.b.: Spain usage),0.13088780641555786,0.7574102878570557,0.11170198023319244,0.006700247060507536,0.9678348898887634,0.025464925915002823
cortar las alas a  alg.,clip someone’s wings; nip something in the bud (lit.: cut  the wings of someone or something),0.16764956712722778,0.7081635594367981,0.1241869106888771,0.2952186167240143,0.6968235373497009,0.007957815192639828
cortar un pelo en el  aire,be smart,0.1716429442167282,0.7567458748817444,0.07161115854978561,0.009919138625264168,0.40273135900497437,0.5873494148254395
corto de luces,dim; dull; stupid,0.40704914927482605,0.47727617621421814,0.11567473411560059,0.9747985005378723,0.020499814301729202,0.004701650235801935
cuando pueda,when you can; when you have a moment,0.15398231148719788,0.6915971040725708,0.15442058444023132,0.00514143705368042,0.6237625479698181,0.37109604477882385
cuanto antes,as soon as possible (lit.: as much before),0.21415337920188904,0.6548136472702026,0.13103295862674713,0.005590291693806648,0.9640932083129883,0.030316518619656563
cuatro gatos,a handful of people; half a dozen people; a small group of  people (lit.: four cats),0.28235700726509094,0.5460256934165955,0.17161734402179718,0.006738194730132818,0.9532476663589478,0.04001409187912941
dar a algn para el  pelo,be the living daylights out of someone; wipe the floor with  someone,0.04014434665441513,0.904810905456543,0.05504471808671951,0.016708530485630035,0.7625396251678467,0.2207518219947815
dar a entender,let someone know,0.14221705496311188,0.6827840209007263,0.1749989241361618,0.015004550106823444,0.9443795084953308,0.04061596095561981
dar a la luz,give birth (lit.: to give to the light),0.06945245712995529,0.5775600671768188,0.35298752784729004,0.009477399289608002,0.9674884080886841,0.02303427830338478
dar la bienvenida,welcome (lit.: to give the welcome),0.02098667621612549,0.36718037724494934,0.6118329763412476,0.0016340046422556043,0.14089319109916687,0.857472836971283
dar la lata,be a nuisance; annoy (lit.: to give the tin),0.27137044072151184,0.5996098518371582,0.12901973724365234,0.05967582389712334,0.8822110891342163,0.05811315029859543
dar lástima,make someone sad (to) (lit.: to give pain/sadness),0.7215843796730042,0.24100607633590698,0.03740955516695976,0.9372081160545349,0.05989477410912514,0.0028971205465495586
dar luz verde,give a green light to; permit; allow; clear,0.07023702561855316,0.6044214963912964,0.32534143328666687,0.005388213321566582,0.9518134593963623,0.04279831051826477
dar muerte a,kill someone,0.4757923185825348,0.4534968137741089,0.07071086019277573,0.9531608819961548,0.04078638181090355,0.006052702199667692
dar nacimiento a,give rise to,0.14216740429401398,0.6924085021018982,0.16542412340641022,0.02203921414911747,0.922973096370697,0.05498768389225006
dar palo,hate; dislike; be unfortunate,0.36113959550857544,0.5158417224884033,0.12301868200302124,0.9485371112823486,0.047628726810216904,0.0038341230247169733
dar permiso,permit; allow; give permission,0.2519274353981018,0.5687836408615112,0.17928895354270935,0.006220473442226648,0.948638379573822,0.04514121264219284
dar risa,make one laugh; make one smile,0.3735983967781067,0.4675883948802948,0.15881319344043732,0.0015951640671119094,0.08071654289960861,0.9176883697509766
dar un paseo a  caballo,go horseback riding; ride a horse,0.04422112554311752,0.5576951503753662,0.39808377623558044,0.0037719975225627422,0.8965352773666382,0.09969276934862137
dar un patatús a  alguien,make someone have a fit (lit.: to give someone a fit),0.670455276966095,0.3011194169521332,0.028425218537449837,0.05527326092123985,0.9313870072364807,0.013339689932763577
dar un salto,jump; give a start; start (lit.: to give a jump),0.09040015935897827,0.7013648152351379,0.2082350105047226,0.004573803395032883,0.9177942276000977,0.07763194292783737
dar un vergajo,screw; fuck; have sex with; shag,0.7188689708709717,0.22154822945594788,0.05958278849720955,0.9685006141662598,0.028408043086528778,0.0030913392547518015
dar una de cal y otra  de arena,use a carrot-and-stick policy,0.29042690992355347,0.6321951746940613,0.07737790048122406,0.11722307652235031,0.8705524802207947,0.012224440462887287
dar una fiesta,give a party,0.06257915496826172,0.642041027545929,0.2953798174858093,0.009266942739486694,0.8648654818534851,0.12586760520935059
dar una vuelta,go for a ride,0.05755824223160744,0.6596329212188721,0.2828088104724884,0.007370993960648775,0.9137566089630127,0.07887245714664459
dar vida a,portray; play (i.e.: an actor playing a role),0.0625152662396431,0.4766119122505188,0.4608728587627411,0.005941982846707106,0.9679493308067322,0.02610873617231846
darle a alguien mala  espina,make someone feel uneasy (lit.: to give bad thorns to someone),0.8526661396026611,0.13672225177288055,0.010611635632812977,0.7857718467712402,0.2102702111005783,0.003957883920520544
darse cuenta de,be aware; realize (lit.: to give oneself account of).,0.32024097442626953,0.5728328227996826,0.10692618787288666,0.006913451012223959,0.9326571226119995,0.06042943522334099
darse por vencido,give up; give in (lit.: to give oneself as defeated),0.504928469657898,0.43949204683303833,0.05557951331138611,0.22777187824249268,0.7553458213806152,0.016882309690117836
darse prisa,hurry; rush; do (something) fast (lit.: to give one urgency),0.24041618406772614,0.5992419123649597,0.16034191846847534,0.01589120738208294,0.9540591239929199,0.030049646273255348
de abrigo,"a handful; someone to watch out for (lit.: coat, overcoat)",0.08093626797199249,0.705618143081665,0.21344555914402008,0.07230044156312943,0.9163112044334412,0.01138839591294527
de ahí en adelante,from now on; from here onward (lit.: from here in forward),0.08380595594644547,0.7235233187675476,0.19267073273658752,0.005595743656158447,0.9649418592453003,0.029462430626153946
de ahora en adelante,from now on; henceforth; from this moment forward (lit.:  from now in advance),0.047635167837142944,0.7254427075386047,0.2269221693277359,0.004602698143571615,0.9579389095306396,0.03745831921696663
de armas tomar,formidable; tough; redoubtable (lit.: for taking up arms),0.18525393307209015,0.6685453057289124,0.1462007462978363,0.011889726854860783,0.8720468282699585,0.11606349050998688
de buena gana,willingly; with ease; with pleasure (lit.: of good desire),0.013178630731999874,0.16528640687465668,0.8215349316596985,0.0011232562828809023,0.0288801658898592,0.9699965715408325
de buenas a primeras,suddenly; without warning,0.04294133558869362,0.40421828627586365,0.5528404116630554,0.48002922534942627,0.510737955570221,0.009232842363417149
de cal y canto,strong; firm,0.13797393441200256,0.6928751468658447,0.1691509485244751,0.00628243200480938,0.38440486788749695,0.6093127131462097
de costumbre,as usual; normally,0.32772812247276306,0.577579915523529,0.09469190984964371,0.02701479010283947,0.9495427012443542,0.023442458361387253
de cuando en cuando,from time to time; sometimes; once in a while (lit.:  of when in when),0.07784964889287949,0.8182191252708435,0.10393130034208298,0.008022782392799854,0.9689467549324036,0.02303045429289341
de diario,everyday,0.24664326012134552,0.6012918949127197,0.15206487476825714,0.04146059975028038,0.8693709373474121,0.08916844427585602
de golpe,suddenly; abruptly; at once; all at once (lit.: of a blow or  strike),0.3764641284942627,0.519314706325531,0.10422119498252869,0.2965654134750366,0.6950505375862122,0.00838408526033163
de hecho,"in fact, in reality (lit.: of fact).",0.34063705801963806,0.5300551056861877,0.12930776178836823,0.009762573055922985,0.9704034328460693,0.01983392797410488
de inmediato,"right now, immediately (lit.: from immediately)",0.16447234153747559,0.7026862502098083,0.13284137845039368,0.007577049545943737,0.9678605198860168,0.024562375620007515
de medio pelo,second-rate,0.5040885806083679,0.4232141375541687,0.0726972371339798,0.5485870242118835,0.4309558570384979,0.02045714296400547
de miedo,fantastic(ally); wonderful(ly); brilliant(ly) (used in  Spain),0.45808398723602295,0.43012261390686035,0.1117934137582779,0.0013169841840863228,0.047335170209407806,0.9513477683067322
de moda,in fashion; in style,0.26794669032096863,0.5987187623977661,0.13333450257778168,0.0037871634121984243,0.6727147698402405,0.32349804043769836
de modo que,so; so that,0.24446170032024384,0.6818082332611084,0.07373005151748657,0.01613968051970005,0.934015691280365,0.04984462633728981
de mucho cuidado,big; terrible; real (used adverbially),0.10706469416618347,0.5435283780097961,0.3494069278240204,0.9621167182922363,0.03442394733428955,0.003459434024989605
de nada,not at all; you’re welcome; don’t mention it (n.b.: often  said in response to “gracías”),0.24767261743545532,0.5786664485931396,0.17366094887256622,0.010577895678579807,0.21050994098186493,0.7789121270179749
de nuevo,again; once again; anew (lit.: of new),0.2638324499130249,0.5768658518791199,0.15930171310901642,0.007289127912372351,0.9381812810897827,0.05452963337302208
de oro,great; good; very good; wonderful.,0.3505169153213501,0.5029231309890747,0.1465599536895752,0.002805370604619384,0.004864851012825966,0.9923297762870789
de par en par,wide open (lit.: from rafter to rafter),0.11778698861598969,0.7390367388725281,0.14317627251148224,0.005740911699831486,0.9704466462135315,0.023812387138605118
de pelo en pecho,manly; masculine,0.22534435987472534,0.6410184502601624,0.1336371749639511,0.015986604616045952,0.9265998005867004,0.05741356313228607
de perlas,just what someone needs; just right; go/fit perfectly (lit.:  of pearls),0.10447445511817932,0.29932457208633423,0.5962010025978088,0.001622239244170487,0.14804373681545258,0.8503339886665344
de perros,foul; horrible; dirty,0.2643791735172272,0.5902910828590393,0.14532969892024994,0.9807320237159729,0.015286127105355263,0.003981785383075476
de pocas luces,dim; dull; stupid,0.6373007893562317,0.305030882358551,0.057668350636959076,0.9747985005378723,0.020499814301729202,0.004701650235801935
de pronto,suddenly; at once; all at once (lit.: of soon),0.266775906085968,0.5877541303634644,0.14546996355056763,0.012910027988255024,0.9644520282745361,0.022637968882918358
de repente,"abruptly, suddenly (lit.: of soon)",0.19983841478824615,0.6804126501083374,0.11974897235631943,0.3077680766582489,0.6854380965232849,0.0067937979474663734
"de tal palo, tal  astilla","like father, like son (lit.: of such a broom, such a  splinter)",0.4653759300708771,0.43011027574539185,0.10451377183198929,0.0042326911352574825,0.6929033994674683,0.3028639256954193
de todas maneras,in any case; anyway,0.15470926463603973,0.6830523014068604,0.16223841905593872,0.12239913642406464,0.8617346882820129,0.01586621068418026
de todos modos,anyway; at any rate (lit.: to the monkfish),0.30600181221961975,0.5992988348007202,0.09469935297966003,0.0171219389885664,0.9690276980400085,0.01385039184242487
de un modo u otro,one way or another,0.14255771040916443,0.8019120693206787,0.055530209094285965,0.10136719048023224,0.8700346350669861,0.028598161414265633
de un momento a otro,at any moment,0.28070855140686035,0.638310968875885,0.08098050206899643,0.027365734800696373,0.9120546579360962,0.060579605400562286
de una vez,now,0.1854291707277298,0.6840245723724365,0.13054625689983368,0.03879152610898018,0.8694343566894531,0.0917740985751152
de veras,"really, truly (lit.: of fact, truth)",0.40630269050598145,0.5053608417510986,0.08833644539117813,0.005684969946742058,0.9430674910545349,0.05124753713607788
de vez en cuando,sometimes; now and then (lit.: from once in when),0.044875357300043106,0.7534249424934387,0.20169971883296967,0.006877172738313675,0.9626365303993225,0.030486296862363815
decir amén a todo,say yes to everything; agree to everything (lit.: to say  amen to everything),0.08995906263589859,0.5391879081726074,0.3708530366420746,0.0017800424247980118,0.13674180209636688,0.8614781498908997
decir en broma,kid; joke; tease (lit.: to say (as a) joke),0.23698410391807556,0.6640985012054443,0.09891743212938309,0.05406224727630615,0.9275691509246826,0.01836862787604332
dejar a alg en las  astas del toro,leave someone high and dry; leave someone in the lurch  (lit.: to leave someone on the horns of the bull),0.382954478263855,0.5787277221679688,0.03831778094172478,0.3565308749675751,0.6350383758544922,0.008430717512965202
dejar de lado,set aside; put aside (lit.: to leave from (the) side),0.33429378271102905,0.5554255247116089,0.11028075218200684,0.0073235598392784595,0.9748691916465759,0.017807243391871452
dejar en paz,leave alone; leave be; let it be (lit.: to leave in peace),0.08761932700872421,0.5712302923202515,0.3411503732204437,0.008875636383891106,0.8858258724212646,0.10529845207929611
desde hacía rato,for some time,0.19351916015148163,0.6465029120445251,0.15997792780399323,0.017188120633363724,0.9517536163330078,0.03105824999511242
desde luego,of course; certainly (lit.: after then/later),0.27807432413101196,0.548315167427063,0.17361050844192505,0.003907192498445511,0.8650458455085754,0.13104698061943054
día a día,day after day.,0.1143035814166069,0.516567587852478,0.3691288232803345,0.09311515837907791,0.8883791565895081,0.018505705520510674
di que sí,go for it (lit.: say yes),0.09102725982666016,0.4412389099597931,0.467733770608902,0.0017241932218894362,0.06076906993985176,0.9375067353248596
dormir el vino,sleep off a hangover,0.17084579169750214,0.4991643726825714,0.32998985052108765,0.14075392484664917,0.8246734738349915,0.03457261621952057
dormir juntos,sleep together (n.b.: in the sexual sense),0.19020076096057892,0.6279390454292297,0.18186019361019135,0.006233226973563433,0.9542455077171326,0.03952132165431976
echar agua al vino,water down,0.16543656587600708,0.6218506097793579,0.2127128541469574,0.06444454938173294,0.8857297897338867,0.049825627356767654
echar ajos y cebollas,swear; curse; rant and rave (lit.: throw garlic and onions),0.13955897092819214,0.7131022214889526,0.14733880758285522,0.6722437739372253,0.31815361976623535,0.009602596051990986
echar de menos,miss; feel the absence of (lit.: to throw less).,0.6378616690635681,0.25087663531303406,0.11126166582107544,0.6151401400566101,0.3782998025417328,0.006560030393302441
echar el pelo,waste time (used in Cono del Sur),0.1813429445028305,0.6491317749023438,0.16952528059482574,0.9306703209877014,0.06671509891748428,0.0026146722957491875
echar el toro a algn,scold somebody severely (lit.: throw the bull to somebody),0.1974867284297943,0.722165584564209,0.0803476870059967,0.9682769179344177,0.028656939044594765,0.003066085511818528
echar mano a,lay hands on; get one's hands on,0.18368805944919586,0.6576922535896301,0.1586197018623352,0.1406865119934082,0.8471361398696899,0.012177354656159878
echar mano de,make use of; resort to,0.19541975855827332,0.6846749186515808,0.11990533769130707,0.004967033863067627,0.8529998660087585,0.14203312993049622
echar por el atajo,take the easy way out (lit.: throw for the shortcut),0.09293659031391144,0.344102680683136,0.5629608035087585,0.013102902099490166,0.872535228729248,0.11436184495687485
echar un mano,help; assist (lit.: to throw less),0.07836584746837616,0.5600204467773438,0.3616137206554413,0.04174313321709633,0.946895956993103,0.011360907927155495
echar un ojo a,have one’s eye on; covet (lit.: to throw an eye at),0.05847155675292015,0.4193129539489746,0.5222154855728149,0.007826138287782669,0.9433290362358093,0.048844799399375916
echar un vistazo,look around; glance; take a look (lit.: to throw less),0.07681352645158768,0.5607259273529053,0.36246055364608765,0.03637915104627609,0.9301350712776184,0.03348585218191147
echar una bronca,hit hard; come down on,0.9010095596313477,0.06133129820227623,0.03765907138586044,0.03132033720612526,0.9070059657096863,0.061673711985349655
echar una furia,throw a fit,0.09588531404733658,0.6080285906791687,0.2960861027240753,0.8454001545906067,0.14229241013526917,0.012307509779930115
echar una mano a algn,let someone a hand; give someone a hand; help someone (lit.:  throw a hand to someone),0.04212576150894165,0.6985309720039368,0.25934329628944397,0.00430338317528367,0.9028846025466919,0.09281203895807266
echarle los perros a  algn,come down hard on someone (lit.: throw dogs at someone),0.23327244818210602,0.7105024456977844,0.05622517690062523,0.9597436785697937,0.03692569583654404,0.003330557607114315
echarlo todo a rodar,mess it all up; make a mess of everything,0.25340360403060913,0.5162107944488525,0.23038563132286072,0.9475635886192322,0.04787556082010269,0.004560759756714106
echarse un novio/-a,get a boy/girlfriend (used in Spain),0.1202288568019867,0.673065721988678,0.20670536160469055,0.007012615446001291,0.9690515398979187,0.02393592707812786
"el cuatro es nota, el  resto es lugo","four is passing, anything else is a luxury (used in  Argentina)",0.20038481056690216,0.7636675238609314,0.03594771400094032,0.008383579552173615,0.8601187467575073,0.13149774074554443
el pensamiento no  tiene/conoce barreras,you can think whatever you like (lit.: thought does not  have/know barriers),0.31420156359672546,0.612609326839447,0.07318912446498871,0.04454478994011879,0.9293627142906189,0.026092473417520523
"el que se pica, ajos  come","if the shoe fits, wear it",0.3735370337963104,0.5018630623817444,0.12459996342658997,0.006196212023496628,0.5599039196968079,0.433899849653244
el último grito,the latest thing (lit.: the latest cry),0.221554696559906,0.6156576871871948,0.16278766095638275,0.015013816766440868,0.9712188839912415,0.013767254538834095
en absoluto,at all; (not) at all (usually used with a negative verb).,0.22793105244636536,0.6723310351371765,0.09973786771297455,0.34738558530807495,0.6464138031005859,0.006200638599693775
en adelante,from now on,0.219325453042984,0.6628023982048035,0.11787214875221252,0.01700166054069996,0.9356957674026489,0.04730254039168358
en bolas,naked; nude; in the buff (Spain usage; lit: in balls),0.25022757053375244,0.63438880443573,0.11538359522819519,0.009436343796551228,0.9656422734260559,0.024921365082263947
en bolas,in a group; together (Mexican usage; lit.: in balls),0.25022757053375244,0.63438880443573,0.11538359522819519,0.007023032754659653,0.974704384803772,0.01827256567776203
en cambio,on the other hand,0.25517258048057556,0.64478999376297,0.10003746300935745,0.012305074371397495,0.943654477596283,0.044040434062480927
en carne viva,in the flesh (lit.: in living meat),0.14930881559848785,0.652628481388092,0.1980627030134201,0.0275471992790699,0.9594061374664307,0.013046616688370705
en carne viva,raw; full; complete,0.14930881559848785,0.652628481388092,0.1980627030134201,0.0038508970756083727,0.8857447504997253,0.11040434241294861
en carne y hueso,in the flesh,0.1371636837720871,0.7475247383117676,0.11531158536672592,0.01909843273460865,0.9290269613265991,0.05187457427382469
en caso de,in case of; in case,0.06290493905544281,0.8375595808029175,0.09953553229570389,0.02665012702345848,0.9536253213882446,0.019724546000361443
en cuanto a,as for; when it comes to (lit.: in how much to).,0.08315364271402359,0.8547751903533936,0.062071166932582855,0.011082876473665237,0.9739450216293335,0.014972111210227013
en cuerpo y alma,body and soul,0.07426852732896805,0.577327311038971,0.3484041690826416,0.022524245083332062,0.9435291290283203,0.03394659608602524
en definitiva,in short; in brief,0.26141491532325745,0.6265920996665955,0.1119929626584053,0.011422413401305676,0.9454336762428284,0.04314389079809189
en el acto,in the act; red-handed,0.07668253034353256,0.7883144021034241,0.13500310480594635,0.05912219360470772,0.9099510908126831,0.030926674604415894
en el medio de la  nada,in the middle of nowhere (lit.: in the middle of (the)  nothing),0.6416025161743164,0.31874001026153564,0.03965747728943825,0.08910344541072845,0.8923138976097107,0.018582697957754135
en fin,in short; in brief,0.3401544988155365,0.5950981378555298,0.06474743038415909,0.011422413401305676,0.9454336762428284,0.04314389079809189
en lo más mínimo,in the least bit,0.09781593084335327,0.8105193972587585,0.09166475385427475,0.06518752127885818,0.901961088180542,0.03285137936472893
en lugar de,"insted of, in place of (lit.: in place of)",0.09595920890569687,0.8353559970855713,0.06868476420640945,0.010702780447900295,0.9757118821144104,0.013585262931883335
en manos de,in the hands of,0.09308105707168579,0.6883723735809326,0.21854659914970398,0.06932713836431503,0.9167729020118713,0.013899900019168854
en pie de,on the verge of (lit.: at (the) foot of),0.08049368113279343,0.7130048274993896,0.20650151371955872,0.014224866405129433,0.966316282749176,0.019458871334791183
en pos de,in pursuit of; after,0.11621443927288055,0.7838006615638733,0.09998491406440735,0.006518091540783644,0.949868381023407,0.04361353814601898
en realidad,actually; really; in reality,0.24364295601844788,0.6631299257278442,0.0932270884513855,0.02139163203537464,0.9385047554969788,0.040103621780872345
en resumen,in sum; in brief; briefly,0.27856117486953735,0.6339415907859802,0.08749724924564362,0.005761262029409409,0.9612608551979065,0.032977938652038574
en seguida,right away; at once; immediately,0.07113663852214813,0.7327116131782532,0.1961517632007599,0.008326956070959568,0.929553210735321,0.06211984157562256
en serio,"really, truly, seriously (lit.: in serious)",0.34791404008865356,0.5786648392677307,0.07342113554477692,0.01060996949672699,0.8709313869476318,0.11845865100622177
en todo caso,in any case; in any event; anyway,0.0873429924249649,0.8043264150619507,0.10833065211772919,0.050440579652786255,0.9241797924041748,0.025379644706845284
en tu/su lugar,in your/his/her place (lit.: in your/his/her place),0.059211231768131256,0.79094398021698,0.14984475076198578,0.009684213437139988,0.9704321622848511,0.01988360472023487
en un abrir y cerrar  de ojos,very quickly; in a flash; in the blink of an eye (lit.: in  the opening and closing of eyes.,0.18273457884788513,0.6506556868553162,0.16660979390144348,0.008739021606743336,0.9091193675994873,0.08214156329631805
en un decir amén,in a flash; in a jiffy; in next to no time (lit.: in the  saying of amen),0.049167901277542114,0.5591073036193848,0.3917247951030731,0.007128688041120768,0.8581991195678711,0.13467222452163696
en vez de,instead of (lit.: in time of),0.11565379053354263,0.7901536226272583,0.09419262409210205,0.01645360328257084,0.9719067811965942,0.011639623902738094
